{
  "schemaVersion": "3.2",
  "reportId": "RELEASE-AUDIT-001",
  "taskId": "TASK-001",
  "candidateId": "replace-with-candidate-id",
  "candidateCommit": "replace-with-40-char-commit",
  "candidateTree": "replace-with-40-char-tree",
  "candidate": {"path": ".vibe-control/candidates/replace-with-candidate-id.json", "bytes": 0, "sha256": "replace-with-64-char-sha256", "tracked": true},
  "keyObjectives": {"path": ".vibe-control/key-objectives-lock.json", "bytes": 0, "sha256": "replace-with-64-char-sha256", "tracked": true},
  "positioning": {"path": ".vibe-control/project-positioning.json", "bytes": 0, "sha256": "replace-with-64-char-sha256", "tracked": true},
  "resolvedRuleSet": {"path": ".vibe-control/resolved-rule-set.json", "bytes": 0, "sha256": "replace-with-64-char-sha256", "tracked": true},
  "review": {"path": ".vibe-control/reviews/REVIEW-001.json", "bytes": 0, "sha256": "replace-with-64-char-sha256", "tracked": true},
  "evidenceRefs": [{"path": ".vibe-control/evidence/EVIDENCE-001.json", "bytes": 0, "sha256": "replace-with-64-char-sha256", "tracked": true}],
  "auditor": {"actorId": "release-auditor", "sessionId": "independent-release-session"},
  "findings": [],
  "transcript": {"path": ".vibe-control/external-audits/release-audit-transcript.txt", "bytes": 0, "sha256": "replace-with-64-char-sha256", "tracked": true},
  "result": "PASS",
  "packageManifestSha256": "replace-with-64-char-sha256",
  "runtimeManifestSha256": "replace-with-64-char-sha256",
  "assuranceMatrixSha256": "replace-with-64-char-sha256",
  "auditedAt": "replace-with-iso-time",
  "keyId": "release-auditor-key",
  "signature": {"algorithm": "Ed25519", "value": "replace-with-base64-signature"}
}
